{
    "packages": [
        "minikube",
        "kubectl",
        "kubernetes-helm-wrapped",
        "docker"
    ],
    "env": {
        "MINIKUBE_HOME": "$PWD/home/.minkube",
        "KUBECONFIG": "$PWD/home/.kube/config"
    },
    "shell": {
        "init_hook": [
            "helm repo add my-repo https://charts.bitnami.com/bitnami"
        ],
        "scripts": {
            "minikube": [
                "finish() { minikube stop; }",
                "trap finish SIGTERM SIGINT EXIT",
                "minikube start",
                "minikube logs -f"
            ]
        }
    },
    "nixpkgs": {
        "commit": "f80ac848e3d6f0c12c52758c0f25c10c97ca3b62"
    }
}